209079,Not working This app is not working it keeps crashing i want my money back ,work pp work keep bug want money back ,1
209080,An essential app for a Samsung owner Does exactly what it says and makes my Galaxy S6 far more efficient and usable for me. Worth every cent! ,essenti pp samson owner exactli say make galaxi far effici unabl worth everi cent ,3
209081,Note 7 scam! Waste of money for Note 7!.... With everything Samsung disabled the update notification is still present. ,note scar wast money note everyth samson disabl updat ratif still present ,1
209082,Amazing Easy to use. Stopped 90 packages. Awesome product! ,amaz easi use stop 90 packag product ,3
209083,Good but could have been better Does the job done but I think it would have been better. ,good could better job done think would better ,3
209084,"Very useful Works like a charm, feels great to remove all the crappy adware. ",use work like charm feel great remov happi awar ,2
209085,"Sell outs. Dont buy First they removed ability to block updates, then they removed manual blocking. How dare you steal my money with this scam. DO NOT BUY ",sell out dont buy first remov abil block updat remov manual block dare steal money scar buy ,2
209086,Fantastic program! Battery life doubled after disabling bloatware. ,fantast program batteri life doubl disabl ,3
209087,"Horrible Id give it ine star if i could, recommended by a samsung rep at best buy......imagine that. Also dont expect a refund unless you get a bill from google ap store, because you have to send your google bill to them in 5 days to get a refund. SCAM. ",horribl id give in star could recommend samson rep best buy imagin also dont feature refund unless get bill goos store send goos bill day get refund scar ,3
209088,Become worst app After update to 7.0 from 6.3 version Now i m unable to disable software updates of samsung. Bring it back or otherwise refund my amount ,becom worst pp updat version unabl disabl softwar updat samson bring back otherwis refund amount ,1
209089,"Not what I wanted I was told it could disable individual badge icons, but instead it disables the entire app. No good. ",want told could disabl individu badg icon instead disabl entir pp good ,1
209090,"Update you did was a fail I highly recommend staying away, they are taking good features out such as software update etc. Bring them back please! ",updat bug highli recommend stay away take good featur softwar updat etc bring back pleas ,2
209091,To many options are disabled withh every update.. Seems to me this will ne ordinary app.. Dont Buy this crap.. Every update 1 or more package removed.. ,mani option disabl with everi updat seem ne ordinari pp dont buy cap everi updat packag remov ,3
209092,Waste Samsung forced them to Not disable updates ,wast samson forc disabl updat ,3
209093,Works as it should. ,work ,3
209094,Package disabler pro does just what it says it will well worth the insignificant $$ it cost no problem with having to root &void your warranty ,packag disabl pro say well worth insignific cost bug root void warranti ,3
209095,can anyone tell me why i can t anymore disable google play store with PDP? ,anyon tell anymor disabl goos play store pp ,1
209096,Slick Worked quick and easy on my Note5. ,sick work quick easi note ,3
209097,Dan Nice! ,dan nice ,3
209098,SCAM Scam scam scam scam!!!!!!!!! ,scar scar scar scar scar ,3
209099,Crap Sellouts ,cap ,3
209100,Stuck/Non functional Stuck in the licence verification screen for some odd reason. Used to be one of my favourite apps. ,function stuck licenc purif screen odd reason use one favourit ape ,1
209101,Does Not work ,work ,1
209102,Note 4 I been use this for years. Then you update new version and cant be disable the software update. Please fix. ,note use year updat new version can disabl softwar updat pleas fix ,1
209103,Please fix your activation logic Always putting me through please wait for activation. ,pleas fix motiv logic alway put pleas wait motiv ,1
209104,2016/12/21,"So long samsung pay, perfect I got this as a recommendation from google play support and wow did this work exactly as I wanted, just to quick taps and samsung pay was gone. No more virus like unusable crap ",long samson pay perfect got recommend goos play support now work exactli want quick cap samson pay gone viru like unabl cap ,3
209105,BEWARE After installing this in an attempt to get trinus to work it disabled my alarm sounds and some system sounds. I was late for work and could not get my alarm working until I uninstalled the app and rebooted the phone. ,bewar attempt get thing work disabl alarm sound system sound late work could get alarm work instal pp report phone ,1
209106,"It working like a charm on Samsung galaxy j7 2016, all bloatware are disabled properly. ",work like charm samson galaxi 2016 disabl properli ,3
209107,Works as advertised FINALLY got rid of that stupid Samsung keyboard. Worth it not to go thru the hassle of rooting for the umpteenth time on my latest Android device. ,work advertis final got rid stupid samson keyboard worth go thou hast foot time latest andro devic ,3
209108,Unable to constraint gear vr setup wizard Gear vr setup wizard is able to run and download some data which means your app is not able to totally disable it ,unabl constraint gear or set wizard gear or set wizard abl run download data mean pp abl total disabl ,1
209109,Awesome Best app to freeze services. Customer service is amazing too! ,best pp bug servic custom servic amaz ,3
209110,Galaxy s7 ,galaxi ,3
209111,Do not buy I purchased this to block Samsung updates. But the new version stopped these blocking features leaving the note 7 vulnerable without warning. ,buy purchas block samson updat new version stop block featur leav note vulner without warn ,1
209112,Intrusive As soon as I read the intrusive privacy statement I uninstalled it. Not letting them collect and share info from my phone. Completely unnecessary! Please refund my purchase. ,intrus soon read intrus privaci statement instal let collect share into phone complet unnecessari pleas refund purchas ,2
209113,"Great App Would help, if I know what to disable.. ",great pp would help know disabl ,2
209114,Uses knox now.. Totally destroyed. ,use knox total destroy ,3
209115,Does what it sez. Sez what it does. If new to this you must have everything backed up and know how to manually factory reset phone. Luckily I had spare phone to mess with. If unsure what to disabe press on package then press google it. Personally I think there should also be a you tube it button. You can very easily go no where fast just googling it. But not always. ,sez sez new must everyth back know mental factori rest phone luckili spare phone mess ensur diseas press packag press goos person think also tube button easili go fast cool alway ,2
209116,Please refund double purchase I gave this app a try and promptly uninstalled because i realized key selling feature was disabled. Please refund purchase. My phone serial number is none of your business and irrelevant to my refund request! Filed claim with PayPal. ,pleas refund doubl purchas gave pp tri promptli instal realiz key sell featur disabl pleas refund purchas phone aerial number none busi irrelev refund request file claim papal ,3
209117,"Do not update this app! You will lose the ability to block system updates on your Samsung device. I am keeping the older version which does exactly what I bought it for. Funny there is no mention of this fact when you read about the app. Whay does ""Manual Disabling Removed"" mean? It means they removed the ability to block updates and other garbage. Total junk now. They gave in to Sammy. ",updat pp lose abil block system updat samson devic keep older version exactli bought funni mention fact read pp what manual disabl remov mean mean remov abil block updat garag total june gave same ,1
209118,Not working stuck in Please wait for activation confirmation screen please Dev I need this app to work asap ,work stuck pleas wait motiv confirm screen pleas de need pp work sap ,1
209119,Note 7 Software update.. fail Will block many updates except the main two that any note 7 user is looking for. ..where is the software update packages!!!!?? ,note softwar updat bug block mani updat except main two note user look softwar updat packag ,1
209120,stop disabling useful features ,stop disabl use featur ,2
209121,Great Good app maybe tablet support ,great good pp mayb tablet support ,2
209122,"Note 7 user. Bring back our options! We are paying you, not Samsung. Or... Is it Samsung paying? ",note user bring back option pay samson samson pay ,3
209123,Useless cant use it cant refund wat the hell is this junk ? ,useless can use can refund wat hell june ,3
209124,"Scam. Please do not waste your money on this. Even after disabling several system apps on my s7 edge they show up in the top battery draining services under android system. Requested here for a refund, got no response from the devs. Where I used to get around 4 hours SoT I get about 3 hours now. ",scar pleas wast money even disabl sever system ape edg show top batteri drain servic andro system request refund got respons de use get around hour sot get hour ,3
209125,Awesome. Easy. Necessary. Had to customize what gets disabled but this app literally made my phone actually perform like a phone from 2016 again. I feel like bloat has gotten so bad on the Sprint S7 lately and this was a quick fix. Thanks! ,easi necessari get disabl pp liter made phone actual perform like phone 2016 feel like boat gotten bad spring late quick fix thank ,3
209126,Used to be great Going downhill now ,use great go downhil ,3
209127,Removed features I got it to block system updates. Now the latest update got rid of it. ,remov featur got block system updat latest updat got rid ,2
209128,"N910P After take my money from my digi bill the apps still said please wait for license activation. WTF, i want refund now!!!!! Check my order Order number: GPA.1339-5724-7730-64685 Order date: Dec 7, 2016 2:48:07 AM MYT ",take money dig bill ape still said pleas wait licens motiv utf want refund check order order number gap order date dec 2016 my ,1
209129,"Spend 6 hours trying others This one worked for me, disabling a system activation sim lock message ",spend hour tri other one work disabl system motiv him lock messag ,3
209130,Why disable mode not working ,disabl mode work ,1
209131,"Installed for 10 minutes Installed this app and ""disabled"" bloatware on Verizon galaxy s7. Freed up the smallest amount. Not worth the time, money, and potential risks to your phone. ",instal 10 minut instal pp disabl horizon galaxi freed smallest amount worth time money potenti risk phone ,1
209132,Update made it useless ,updat made useless ,1
209133,crap after this app ..my phone was slower and did worse than before ,cap pp phone slower wors ,1
209134,Um.... Already bought this...but Now...waiting for Activation ,up alreadi bought wait motiv ,1
209135,Waste money for s7 edge Not working on samsung theme store ,wast money edg work samson theme store ,1
209136,Old boy ,old boy ,3
209137,Stop Disabling Features!!! Stop Disabling Features!!! ,stop disabl featur stop disabl featur ,2
209138,awesome app! big thanks to developer! ,pp big thank develop ,3
209139,Whoa Works like a charm.... ,whoa work like charm ,3
209140,Junk App is crap now with the removal of not being able to disable system updates. ,june pp cap remov abl disabl system updat ,1
209141,Crap since they removed update block Removes ability to block updates. Will be crap from here on forward ,cap sinc remov updat block remov abil block updat cap forward ,1
209142,Removed only useful feature Only reason I bought was to disable the forced updates ,remov use featur reason bought disabl forc updat ,2
209143,DEFINITELY Worth the price Saves like 50% of my battery life on a daily basis! Good work guys! ,definit worth price save like 50 batteri life daili basi good work gun ,3
209144,Awful Removed system update ,aw remov system updat ,2
209145,Last update killed it Now i have to agree to KLMS and Knox to use it. Disabling Knox ans Samsung spyware was the reason I got this app in the fist place. ,last updat kill agre alm knox use disabl knox and samson spare reason got pp fist place ,2
209146,2016/11/25,"Update no good, down 2 stars Why the heck ""software update/system update"" no longer can be disabled, after 11/23/16 update? This took away the only reason I bought this APP.... Please fix asap. ",updat good star neck softwar updat longer disabl updat took away reason bought pp pleas fix sap ,2
209147,Works so far Have had it for months now. Just make sure you pay attention to updates and modify your packets accordingly ,work far month make sure pay attent updat modifi packet accordingli ,3
209148,Power Saver Now my Samsung Galaxy s7 has a good battery life! Thanks to this app! ,power save samson galaxi good batteri life thank pp ,3
209149,"Why remove features??? Used to be good, now they removed all useful features. Afwul app ",remov featur use good remov use featur aw pp ,2
209150,BEFORE I UPDATE Before I update. I wanna know if I can still disable the Samsung and Google bloatware on my phone after the latest update on 11/23/16?? ,updat updat wan na know still disabl samson goos phone latest updat ,2
209151,Loved this app. Now features are being removed for no apparent reason. ,love pp featur remov appar reason ,2
209152,Took away the ability to block update packages Total scam. DO NOT BUY. BUYER BEWARE. ,took away abil block updat packag total scar buy buyer bewar ,1
209153,I did not update! Why was ability to manually disable apps removed? ,updat abil mental disabl ape remov ,1
209154,Gear vr removal Did not work ,gear or remov work ,1
209155,DO NOT BUY. The developer is removing important features from newer versions (probably to make Samsung happy). I would not purchase this app. ,buy develop remov import featur newer version probabl make samson happi would purchas pp ,2
209156,No good..... Very disappointed Where is the Software updates......? ,good disappoint softwar updat ,1
209157,Fraud Rip off ,fraud rip ,3
209158,Love IT! Verry good app. ,love veri good pp ,3
209159,Took away update disable 1 star. Old version better. DO NOT BUY. ,took away updat disabl star old version better buy ,2
209160,I BRAG ABOUT THIS APP! THIS APPLICATION IS THE ONLY APP THAT I HAVE EVER BRAGGED ABOUT TO PEOPLE WITH ANDROID PHONES! IT MAY SOUND VERY UNIMPORTANT BUT THE TRUTH IS THAT I WAS ABLE TO FULLY TURN OFF 147 SEPARATE APPS AND PROCESSES ON MY T-MOBILE SAMSUNG NOTE 5! I TURNED OFF ALL BLOATWARE SO NOW MY SAMMY IS AS POWERFUL AS MY GOOGLE NEXUS 6P AND I HAVE LITERALLY 2X - 3X BATTERY LIFE! NO OTHER APPLICATION HAS EVER BEEN ABLE TO DO THAT FOR MY SAMSUNG DEVICES! HANDS DOWN IT IS THE BEST DEAL UNDER $5 YOU CAN BUY FOR A PHONE! TRY IT! ,brag pp applic pp ever drag peopl andro phone may sound unimport truth abl fulli turn 147 separ ape process mobil samson note turn same power goos nexu up liter batteri life applic ever abl samson devic hand best deal buy phone tri ,3
209161,"Stopped working on S7Edge Newest update killed it. Will this be fixed, or did I lose my money? ",stop work sledg newest updat kill fix lose money ,1
209162,Removing features Why are features being removed? ,remov featur featur remov ,2
209163,Perfect! This is perfect! Quick and easy disabling of bloat were and other unneeded software. ,perfect perfect quick easi disabl boat unheed softwar ,3
209164,Disables what ever you want Does not help enough in deciding what to disable ,disabl ever want help enough decid disabl ,2
209165,Works! Does what it is supposed to. ,work suppos ,3
209166,Paid for the app and then change so Samsung can update? Paid for the app and then you change it so Samsung can update? Awful. You should give refunds to people who bought it for that reason. ,paid pp chang samson updat paid pp chang samson updat aw give refund peopl bought reason ,1
209167,Still stuck on waiting for license activation I downloaded app last night and have not been able to access app due to license activation hold. Refund my purchase please. ,still stuck wait licens motiv download pp last night abl access pp due licens motiv hold refund purchas pleas ,1
209168,"Very helpful Very helpful, especially for Note 7 users (use ver. 6.3). ",help help especi note user use ver ,3
209169,Awesome Does exactly what is says. Perfect for getting rid of bloatware. ,exactli say perfect get rid ,3
209170,Why KLMS? Why do I have to agree to the KLMS terms of service on my S7 in order to make this work? Is this in the documentation somewhere? ,alm agre alm term servic order make work document somewher ,2
209171,Great This is an easy and effective way of getting rid of unwanted apps that come pre installed on your advice. ,great easi effect way get rid unwant ape come pre instal advic ,3
209172,"No longer working This app used to be really great, but it is no longer working on my galaxy s7. Very unfortunate, would love to here from the developers on when they expect to have a fix ",longer work pp use realli great longer work galaxi unfortun would love develop feature fix ,1
209173,Umm no disabling in a disabling app? This is a scam please do not buy. The new update just removed the ability to disable apps. LOL what a joke you are! ,ulm disabl disabl pp scar pleas buy new updat remov abil disabl ape ll joke ,2
209174,Great app does what you need it to do ,great pp need ,3
209175,Excelent. Works as expected Excelent. Works as expected. Thanks ,excel work feature excel work feature thank ,3
209176,galaxy s6 last update screwed it up. cant disable anymore apps or bloatware. WTH! ,galaxi last updat screw can disabl anymor ape with ,1
209177,VPN & collecting data!! Why you should chance your term and policy and add a VPN to collect every activities in my mobile? I want a refund. ,van collect data chanc term polici feature van collect everi activ mobil want refund ,2
209178,Theme store Theme store not working... ,theme store theme store work ,1
209179,"Beware! It disables Google hangouts if you choose bloatware option! Not cool! More apps marked as bloatware, which are not. Also disables battery settings altogether. ",bewar disabl goos choos option cool ape mark also disabl batteri set altogeth ,1
209180,Works as described. Best way to free up resources without root. ,work describ best way free resourc without root ,3
209181,Licesnse is not activating.... I enabled Administration then it says waiting to verify license and then sits there and sits there and sit there and sits there and sits there ,licens captiv enabl administr say wait verifi licens sit sit sit sit sit ,1
209182,Just works Disables most apps and services without root ,work disabl ape servic without root ,3
209183,2016/11/23,"3 star, was 5 The removal of ability to block software update packages. If legal pressure or something may return. Edit, 1 star no log ",star remov abil block softwar updat packag legal pressur someth may return edit star log ,2
209184,stuck on please wait for license activation ,stuck pleas wait licens motiv ,1
209185,I am not able to use free trail themes after disabling the theme in system app using this app ,abl use free trail theme disabl theme system pp use pp ,1
209186,Waiting for License Activation since 2 weeks App does not run on Samsung Edge 6 plus! ,wait licens motiv sinc week pp run samson edg plu ,1
209187,Froze my phone. Froze my phone and had to factory reset. Would like a refund please.. ,froze phone froze phone factori rest would like refund pleas ,1
209188,This app is complete garbage now. Get a refund. ,pp complet garag get refund ,3
209189,Best app ever Wish I had before rooting no need for that anymore 110% two thunbs up ,best pp ever feature foot need anymor 110 two thumb ,3
209190,"Phone is running as new It really improved my s6 performance. Efeito loads quickly now, thanks to this app. The color coded names are really helpful as well ",phone run new realli improv perform load quickli thank pp color code name realli help well ,3
209191,No longer works Developer did an update today. Now it no longer works on the S7. ,longer work develop updat today longer work ,1
209192,No longer able to disable ,longer abl disabl ,1
209193,Great app! Thanks for this app! Has helped me on many occasions! Great U.I - S7 Edge ,great pp thank pp help mani occas great edg ,3
209194,Helped alot! True disabler! So good I locked myself out of device several times accidently disabling system apps! Great app to keep stalkers out! ,help clot true disabl good lock devic sever time accid disabl system ape great pp keep talker ,3
209195,"I want to refund I used it to change the themes, but always drop to my original after 5 minutes..... ",want refund use chang theme alway drop origin minut ,1
209196,Stuck on please wait for license activation Why this app stuck on please wait for license activation? And how long I have to wait? ,stuck pleas wait licens motiv pp stuck pleas wait licens motiv long wait ,1
209197,Drains more battery and 5 day refund is a scam ,drain batteri day refund scar ,1
209198,Used to be good. Now that I need to disable the note 7 force update it doesnt work. You cheated us. ,use good need disabl note forc updat doesn work creat us ,1
209199,This app saved me. ,pp save ,3
209200,Does not stop OTA update ,stop ta updat ,1
209201,Took off samsung updates garbage now ,took samson updat garag ,1
209202,suddenly it didnt work but now it works ,suddenli didn work work ,1
209203,"Worked great but recently stopped. Worked like a charm, but stopped for unknown reason. Tried to add more apps to disable and it said it was unable to. Told me to disable the app in administrator list but none of them were on the list. Please help. Can provide exact messages if needed. Will change to 5 stars if fixed. ",work great recent stop work like charm stop unknown reason tri feature ape disabl said unabl told disabl pp administr list none list pleas help provid exact messag need chang star fix ,1
209204,Works beautifully My galaxy s5 has become fast and smooth like it has been factory reset. Worth every penny ,work beauti galaxi becom fast smooth like factori rest worth everi penni ,3
209205,"Used to work.. not anymore Now when I try to disable an app I get the little notification telling me to enable device admin, when I have... ",use work anymor tri disabl pp get littl ratif tell enabl devic admit ,1
209206,Best ever You r the best for my note 7 ,best ever best note ,3
209207,It works! Just about doubled battery duration with disabling bloatware with one click of this app! Great! ,work doubl batteri durat disabl one click pp great ,3
209208,awsome this is better than root ,some better root ,3
209209,Awesome and battery saving ,batteri save ,3
209210,Works like a charm Good stuff! ,work like charm good stuff ,3
209211,Does what is says. ,say ,3
209212,Absolutely love it The only reason to root my devices was bloatware. With this app there is no need to do it. Thank you for the lovely app. ,absolut love reason root devic pp need thank love pp ,3
209213,Question Sens excelent BUT Ihad to give app (and thereforedev?) Admin power. Is this risky? ,question sen excel had give pp admit power riski ,2
209214,Why update? The description of the Nov 3rd update is very ambiguous... Can you please explain? ,updat descript nov rd updat ambigu pleas explain ,2
209215,How can I get my refund? I want a refund ,get refund want refund ,3
209216,Keep your Note 7 Alive! This app can keep your Note 7 alive if you delete the packages the devleioer just removed from the list. Long live the note 7!! ,keep note aliv pp keep note aliv delet packag remov list long live note ,3
209217,Seems to work ok But why when I hit the know more button it takes me to a message in Chrome saying page not known? ,seem work ok hit know button take messag come say page known ,1
209218,It used to be useful With every update the list of what it blocks gets shorter...I will change my rating if I see improvement ,use use everi updat list block get shorter chang rate see improv ,1
209219,Really useful ,realli use ,3
209220,Wonder twins activated. ,wonder twin activ ,3
209221,Unable to Refund! Why is the refunding option not working?? ,unabl refund defend option work ,1
209222,Brilliant and it works Carat shows that Samsung Spen and Scrapbook was hogging my battery. Package Disabler allows me to disable them. Now they are deactivated so no more hogging my battery. ,brilliant work cart show samson seen hug batteri packag disabl allow disabl hug batteri ,3
209223,"As advertised Until the time there will be a way to root my device, this app here is my best friend. ",advertis time way root devic pp best friend ,3
209224,Does what I need it to worth the money I bought the app to disable theme store it shows. It work great ,need worth money bought pp disabl theme store show work great ,3
209225,Works Perfectly Ingenious App. Uses Samsung Knox security system to disable the phones own system apps. ,work perfectli ingeni pp use samson knox secur system disabl phone system ape ,3
209226,"Transforms your device! My S7 Edge was lagging like crazy. No matter what I would do, it would get hot, and lag. Downloaded this app, disabled all that Samsung Bloatware, enabled a few I actually use and this phone now flies! It is buttery smooth! This review comes after a few days and heavy use as well. Download this app!!! ",transform devic edg lag like crazi matter would would get hot law download pp disabl samson enabl actual use phone fli batteri smooth review come day heavi use well download pp ,3
209227,"In the updates, why wont those packages be seen on the list? ",updat wont packag seen list ,1
