208349,It works as it should and the developers quickly answered after I had a problem with the app nice one ,work develop quickli answer bug pp nice one ,3
208350,This app does the things it is supposed to do and does them well. What more can you ask for? ,pp thing suppos well ask ,3
208351,Purchaced and licencing fails to load!! Crappy and unfair. Need a refund ,purchas licens bug load happi unfair need refund ,1
208352,Great for finding bloatware as well as disabling the pesky apps that constantly run in the background ,great find well disabl sky ape constantli run background ,3
208353,Perfect for non rooted devices ,perfect non root devic ,3
208354,Astonishing. ,astonish ,3
208355,Work perfect with s7edge android 7.0 ,work perfect sledg andro ,3
208356,Works exactly as expected!! ,work exactli feature ,3
208357,Fully control all Apps in my S6. Love it! ,fulli control ape love ,3
208358,Switched to this app after another like it stopped working once my phone updated to 7.0 ,switch pp anoth like stop work phone updat ,1
208359,Does exactly what it claims and works great. ,exactli claim work great ,3
208360,Does what it says. Works very well ,say work well ,3
208361,Great for disabling bloatware ,great disabl ,3
208362,Bought this because Samsung broke the DQA app but glad that I did because it is very useful to be able to get garbage off the device. And no root! ,bought samson broke da pp glad use abl get garag devic root ,3
208363,Great!!!! My s8+ feels a lot faster ,great feel lot faster ,3
208364,Indispensable ,indispens ,3
208365,Good ,good ,3
208366,My phone is a lot faster now I took off all the bloatware. Super useful. I do love the app ,phone lot faster took super use love pp ,3
208367,"Awesome app for anyone that owns a Samsung device, even works with the new Galaxy S8+. ",pp anyon own samson devic even work new galaxi ,3
208368,"Love it!!! But, why does it keep asking to rate it? I have given a 5 star, yet it asks every time I use it? Re-installed after Nougat update. Works great again! ",love keep ask rate given star yet ask everi time use nought updat work great ,1
208369,I can disable all the bloatware on my S8+ without root. An essential app. Worth all 150 pennies! ,disabl without root essenti pp worth 150 penni ,3
208370,"After purchasing my galaxy 8s and it updated I repeatedly received the error ""DQA has stopped,"" anytime I used Wi-Fi, installing this has helped to eliminate that problem. ",purchas galaxi is updat repeatedli receiv bug da stop daytim use wife help elimin bug ,3
208371,Does what it claims to do. Perfect app. Buy the pro version. ,claim perfect pp buy pro version ,3
208372,LOOK.. . . I Use The App & Like the App But (does what it says) ...... I Hate the too often hassle of the Dreaded license not activating After updating your app. Thank You Dev ,look use pp like pp say hate often hast dread licens captiv date pp thank de ,1
208373,Bloatware gone. Thanks ,gone thank ,3
208374,Fantastic but unsure which to be disabled or removed. ,fantast ensur disabl remov ,2
208375,"Thank you, Bixby is disabled. ",thank babi disabl ,3
208376,"Awesome! Love this app, because it works perfectly. Although please add a root mode for service disabling... ",love pp work perfectli although pleas feature root mode servic disabl ,3
208377,A must for high end unrooted phones ,must high end root phone ,3
208378,Fantastic. I never really knew how much bloatware and unneeded processes were on the phone until this app. Samsung Galaxy S6 Edge Plus and I shut over a hundred and fifty things down LOL with no loss of function to the phone period thank you very much for this excellent app. I love that you can Google search each entry so you at least have a basic idea of what it is and what it does for non-tech guys like me. ,fantast never realli knew much unheed process phone pp samson galaxi edg plu shut hundr fifti thing ll loss function phone period thank much excel pp love goos search entri least basic idea gun like ,3
208379,Black theme makes this app perfect! ,black theme make pp perfect ,3
208380,Love it ,love ,3
208381,Useful for what I need it to do. ,use need ,3
208382,Wow. Just wow ,now now ,3
208383,Wow Wow ,now now ,3
208384,I got this app to fix the DQA error message on the Galaxy S8. It did the job! Problem resolved. ,got pp fix da bug messag galaxi job bug resolv ,3
208385,Why does it keeps asking about license? ,keep ask licens ,1
208386,Excellent ,excel ,3
208387,Excellent!! ,excel ,3
208388,Does what it says. ,say ,3
208389,Great app. Does what it is supposed too. ,great pp suppos ,3
208390,Works like it is supposed to ,work like suppos ,3
208391,Does the job! Thanks! ,job thank ,3
208392,Great for non root blocking ,great non root block ,3
208393,Sped up my Verizon Galaxy S7 edge. Blazing fast now and no lag ,sped horizon galaxi edg blaze fast law ,3
208394,Has every feature. Very reliable. Works perfectly as intended. ,everi featur reliabl work perfectli intend ,3
208395,This is an awesome app and works very well. Thanks for developing it ;) ,pp work well thank develop ,3
208396,Worked great for disabling the bloat ware on my S7. ,work great disabl boat ware ,3
208397,"If I disable sdm(OTA updates) on this app, is it temporary until I reenable it? Will disabling prevent the pop up prompts? Thanks ",disabl sum ta updat pp temporari enabl disabl prevent pop prompt thank ,2
208398,Awesome! ,,4
208399,Awesomeness ,,4
208400,Does what it says on an unrooted Samsung Galaxy s8 plus. Was able kill lots of bloatware without root. ,say root samson galaxi plu abl kill lot without root ,3
208401,Works perfectly for what I needed it for ;-) ,work perfectli need ,3
208402,Nice app ,nice pp ,3
208403,Thank you ,thank ,3
208404,It works great. I doubled my battery life. ,work great doubl batteri life ,3
208405,Was the only thing that ultimately worked for me to stop dqa keeps stopping error message on my galaxy s8+ with at&t. Well written and totally worth 12 bits. ,thing ultim work stop da keep stop bug messag galaxi well written total worth 12 bit ,3
208406,Great apps. Loving every bit of it. Definitely $$ worth spending. ,great ape love everi bit definit worth spend ,3
208407,The best make sure you shut off dtignite ,best make sure shut digniti ,2
208408,Does not work for me ,work ,2
208409,best app ever ,best pp ever ,3
208410,Works again on 7.0 ,work ,3
208411,"This does exactly what I need it to do!! Disable Pretty Much everything I want it to. Especially it disables SUB processes in any app! This has now replaced the previous king of these type of System controllers, (EZ PACKAGE DISABLER) Thank you kinds sir! HI5 ",exactli need disabl pretti much everyth want especi disabl sub process pp replac previou king type system control packag disabl thank kind sir hi ,3
208412,Great!!! ,great ,3
208413,Works like a charm on nougat 7.0 s7 ,work like charm nought ,3
208414,Works great Samsung On5 ,work great samson on ,3
208415,"Wanted an app to disable My Knox, but it could only disable 3 of the 4 services associated with it... screwed the phone and ended up with a factory reset... contacted the developer twice to ask for help or refund but no response... very poor customer service! ",want pp disabl knox could disabl servic associ screw phone end factori rest contract develop twice ask help refund respons poor custom servic ,2
208416,No longer is able to stop Samsung software update. Reason it was purchased. Many like me wont use or buy now. Poor choice to remove this option. ,longer abl stop samson softwar updat reason purchas mani like wont use buy poor choic remov option ,2
208417,Just started using it. May give it 5 stars later if it lives up to it. So far so good. ,start use may give star later live far good ,3
208418,Awesome app for removing bloat ware on unrooted phones! ,pp remov boat ware root phone ,3
208419,Love it ,love ,3
208420,"Disables unwanted bloatware on my samsung, I like it. ",disabl unwant samson like ,3
208421,Had for short period of time....and does not support new OS ,short period time support new os ,2
208422,5 star app for samsung ,star pp samson ,3
208423,Very useful app. Thank you developers ,use pp thank develop ,3
208424,"Absolutely amazing. Does what it says and makes my phone a hella lot faster, smoother and last longer. Without a doubt a 5 star review. Well worth the money ",absolut amaz say make phone hell lot faster smoother last longer without doubt star review well worth money ,3
208425,First phone without root. This was a lifesaver. ,first phone without root ,3
208426,"This app does what it says. I thought it was fantastic, I was able to disable everything I wanted to and the favorite feature it has was very useful to mark certain apps. Definitely would recommend it. ",pp say thought fantast abl disabl everyth want favorit featur use mark certain ape definit would recommend ,3
208427,Next best thing to root. ,next best thing root ,3
208428,Needs active Internet connection to even load. Not cool. ,need activ internet connect even load cool ,2
208429,"Shut down BLOATWARE galaxy S5 on 50+ apps and controlling some services on used apps . makes no difference to phone operation. after setup, save app configuration. ",shut galaxi ape control servic use ape make differ phone oper set save pp configur ,3
208430,It wasnt working before but now it is thank you so much ,want work thank much ,3
208431,Improved my battery life significantly. Thanks. ,improv batteri life significantli thank ,3
208432,Perfect. Works without root. ,perfect work without root ,3
208433,"Fails license verification, even after uninstalling, restarting the phone, and reinstalling. I paid for an app that does not work. T-Mobile S7 with Nougat ",bug licens purif even start phone reinstat paid pp work mobil nought ,1
208434,Beautiful. Thanks for developing this app. ,beauti thank develop pp ,3
208435,each time i disable playstore and g services the app always ask for licence had to deactivate re install and all the fuss till i figured out what was happening ,time disabl servic pp alway ask licenc activ instal fuss till figur happen ,1
208436,"If you like Samsung but hate all the unecessary, battery draining, what the hell is this app for bloatware... then, this pkg disabler is an ABSOLUTE. My favorite feature, is that it allows you to manually enable/disable your ""must have"" battery draining, data hungry apps. Much thanks to the developers.. Great Job1 ",like samson hate necessari batteri drain hell pp pig disabl absolut favorit featur allow mental must batteri drain data hungri ape much thank develop great job ,3
208437,Working again on s7 with Nougat. Back to 5 stars. ,work nought back star ,3
208438,Finally one of my fav app is working in Nougat ,final one far pp work nought ,3
208439,"Finally, the SDK license activation problem for Nougat devices was fixed! Now the app is running again! Thanks KunKunSoft! ",final sd licens motiv bug nought devic fix pp run thank ,3
208440,Does what is supposed to do and does it very well. ,suppos well ,3
208441,"Fixed, runs on S7edge Nougat ",fix run sledg nought ,3
208442,My Samsung 6edge+ kept loading Samsung VR making my phone useless. This app saved the day by letting me deactivate it. ,samson edg kept load samson or make phone useless pp save day let activ ,3
208443,After reinstall it started to work on Samsung S7 Nougat. Nice ,reinstat start work samson nought nice ,3
208444,Working great on S7 7.0! ,work great ,3
208445,"Disable services feature is unique and amazing, i am saving alot battery by disabling many services inside google play services and other apps ",disabl servic featur uniqu amaz save clot batteri disabl mani servic insid goos play servic ape ,3
208446,Edit: working again on Nougat. Gives me at least 15% more battery power after disabling things. ,edit work nought give least 15 batteri power disabl thing ,3
208447,"Used to work on 6.x since 7.x it dont work no more. Im on Samsung S7 Edge tmobile. Update as of March 5, 2017. Tested working on stock 7.0 samsung s7 edge tmo network :) ",use work sinc dont work in samson edg mobil updat march 2017 test work stock samson edg to network ,3
208448,"BK package disabler now works with the Galaxy S7 Edge sprint variant running Nougat 7.0. This is the best package disabler available on the market. Thank you BK developers for correcting the issue with Galaxy S7 running Nougat 7.0 Regards, ThePierExchange, Galaxy S7 Nougat Beta Tester Member... ",by packag disabl work galaxi edg spring variant run nought best packag disabl avail market thank by develop correct issu galaxi run nought regard galaxi nought beta test member ,3
208449,Now working on android 7 ,work andro ,3
208450,does exactly what is says it desables bloatware. thank alot a+ ,exactli say dessal thank clot ,3
208451,"So easy, so effective! ",easi effect ,3
208452,It has worked like a charm from day one. Kudos. ,work like charm day one bud ,3
208453,Thank you for fixing support for att S7 with 7.0. Nice app ,thank fix support att nice pp ,3
208454,Thank you for fixing the program to work on the AT&T S7 Edge! ,thank fix program work edg ,3
208455,"Now we are going places;) Thank you for the fix, S7edge ",go place thank fix sledg ,3
208456,Does what I need it to do ,need ,3
208457,Works well again on nougat 7.0 so no complaints here anymore back to 5 stars. ,work well nought complaint anymor back star ,3
208458,The best is back! ,best back ,3
208459,Updated review - working perfectly again after March 17 update. No more license fails. Tested on Samsung S7 exynos on Nougat. ,updat review work perfectli march 17 updat licens bug test samson nought ,3
208460,Does exactly what it says ! S7EdgeSprint ,exactli say ,3
208461,Programmers fixed the app. They reached out to inform me the app was fixed for Nougat... Awesome CS. Thank you ,programm fix pp reach inform pp fix nought is thank ,3
208462,So far so good.. licensing errors seem to be resolved and working fine for now. ,far good licens bug seem resolv work fine ,3
208463,Awesome!!! ,,4
208464,Cannot activate the license on an s7 with Android 7 ,activ licens andro ,2
208465,A must for every Samsung. ,must everi samson ,3
208466,Thank you finally fixing the Nougat issues. ,thank final fix nought issu ,3
208467,My device is so much more responsive after installing. The issue with the Nougat rollout just proved how valuable it is to me. Thank you ,devic much respons issu nought roylott prove valuabl thank ,3
208468,Good to see it works again on my S7 edge. ,good see work edg ,3
208469,Hey bk disabler after nougat update we cannot use your app please fix it since we bought this app and its not free!! ,hey by disabl nought updat use pp pleas fix sinc bought pp free ,1
208470,I knew it!! I guess they are from same makers of EZ package disabler. They created ez. Made u pay.. then drop and changed its name to BK. Then drop support.. them create a new one called LZ..then the cycle goes on and on and on... ,knew guess maker packag disabl creat made pay drop chang name by drop support creat new one call ll cycl goe ,3
208471,disabled Gear VR services saving me 10-15% battery ,disabl gear or servic save batteri ,3
208472,Works now ,work ,3
208473,Developer fixed problem with app. Now working perfectly. These package disabler apps can be quite unstable though. I have used many of them and they all have licencing issues sometimes. So be prepared for some issues in the future. ,develop fix bug pp work perfectli packag disabl ape quit unstabl though use mani licens issu sometim prepar issu futur ,3
208474,Good. But after i upgrade to nougat. Its not supported. Please update to support with nougat. S7 edge ,good upgrad nought support pleas updat support nought edg ,2
208475,Working good ,work good ,3
208476,Thank you for the Nougat fixed. Back to working simply and perfectly. ,thank nought fix back work simpli perfectli ,3
208477,Wow stupid sprint bloatware and stuff.. This app works great for the s7 edge.. Way faster ,now stupid spring stuff pp work great edg way faster ,3
208478,Will not disable com.wsssyncmldm :( ,disabl com ,2
208479,I paid for this app and now license doesnt even activate it anymore. It was a good app when it worked but now it doesnt... Please refund this purchase! Thanks. ,paid pp licens doesn even activ anymor good pp work doesn pleas refund purchas thank ,2
208480,Working..thanks ,work thank ,3
208481,Good job ,good job ,3
208482,"Excellent like app, gives control over the tons of Samsung bloatware and unnecessary services. Use with some discretion, but especially recommended for older Samsung phones and tablets. Very much appreciate that is available with a family license. ",excel like pp give control ton samson unnecessari servic use discret especi recommend older samson phone tablet much appreci avail famili licens ,2
208483,Not working anymore. ,work anymor ,3
208484,After week or so app do not activate. I want fix or my money back. ,week pp activ want fix money back ,2
208485,Not working on Galaxy S7 after the Android Nougat 7.0 update. ,work galaxi andro nought updat ,1
208486,My galaxy s7 edge updated to Android 7.0 and this app no longer works at all. ,galaxi edg updat andro pp longer work ,3
208487,Not working on nougat ,work nought ,3
208488,Thank you for your response and fixing the licensing issue pushed back to five stars ,thank respons fix licens issu push back five star ,3
208489,Its working again with nougat ,work nought ,3
208490,Stopped work when I updated to android 7. Tried the suggestions in the comments and it is still not working. Shame I wasted money on tbis. ,stop work updat andro tri suggest comment still work shame wast money thi ,3
208491,I trust the developer can make something for us.thanks.now this disabler can use already ,trust develop make someth us thank disabl use alreadi ,3
208492,Very usefull app .. (hope it stays like that ..) A nice thing would be if it prevents disabling some services that kill the phone if disabled ,use pp feature stay like nice thing would prevent disabl servic kill phone disabl ,3
208493,Solved after factory reset and reinstalled. ,solv factori rest instal ,3
208494,What a shame. Get struck on lisence for a very long time. And does not work. ,shame get struck licenc long time work ,3
208495,Disabled a system so easily. Phone is better now ,disabl system easili phone better ,3
208496,"It wont let be install the freaking thing after downloading it again! It says it cant active sdk license. I tried sending a support ticket but I got no replies after a week of waiting. Im 100% I did everything it asked me to do to activate it. EDIT: It works now, thanks! ",wont let instal break thing download say can activ sd licens tri send support ticket got repli week wait in 100 everyth ask activ edit work thank ,3
208497,Edit: Working again! The only non-root app that can disable services ,edit work pp disabl servic ,3
208498,I installed this on nougat and it worked fine. The latest update broke it. Refund requested ,instal nought work fine latest updat broke refund request ,3
208499,"Fantastic app, works well ",fantast pp work well ,3
208500,No refund? What the heck the app is bullshit and doesent even work. ,refund neck pp present even work ,3
208501,"Superb, works great! Love being able to disable all bloatware in one easy step! Signofocantly extends my battery life. ",superb work great love abl disabl one easi step significantli extend batteri life ,3
208502,"Works flawlessly, well-organized, looks good. ",work fearlessli look good ,3
208503,It is worth it. ,worth ,3
208504,"not save if i disabled ""com.android.externalstorage"" because phone will not recharge on power off mode and mtp file transfer has stop working. if i re-enable it everythings is ok. i use mega2 sm-g750h. remove it from bloatware list... ",save disabl com andro phone charg power mode map file transfer stop work refer everyth ok use began remov list ,1
208505,Ok ,ok ,3
208506,"Saved my phone - would recommend this to anyone. Edit: note to devs... it seems as though Samsung are sneakily making your app see things such as Gear VR as system processes rather than bloatware. Makes me wonder how many others in that category are actually bloatware. I picked this us because I disabled GVR when it was marked as bloatware, then a week or two later it had reappeared in the system process list... ",save phone would recommend anyon edit note de seem though samson steadili make pp see thing gear or system process rather make wonder mani other categori actual pick us disabl gr mark week two later reappear system process list ,3
208507,Does what no other app can do IMHO. No root needed. ,pp who root need ,3
208508,"Ahora puedo desactivar las aplicaciones que no me son útiles dentro de TouchWiz y casi duplicar mi batería, es un buen precio, excelentes funciones para búsqueda, etc ",,4
208509,Everyday or 2 the app behaves as if it has been just installed. I know when this will happen because when I attempt to use a widget it tells me I must run the app first ,everyday pp behav instal know happen attempt use wide tell must run pp first ,1
208510,No longer works after nougat update s7. ,longer work nought updat ,1
208511,A much better app than package disabler pro. Breaks up apps into categories and explains what some of the apps do. Never disable android system and system iu. Always have a full back up of everything on your phone. Before disabling system apps you must know how to manually factory reset your device...i think 4 times in one day on my note 3 was my record for factory resets lol ,much better pp packag disabl pro break ape categori explain ape never disabl andro system system in alway full back everyth phone disabl system ape must know mental factori rest devic think time one day note record factori rest ll ,3
208512,Very nice app..now I can get around 500 MB more RAM space after disabling a lot of unnecessary packages. The paid version is useful because you dont have to root your phone. I didnt want to risk rooting the phone and make my warranty void. ,nice pp get around 500 mb ram space disabl lot unnecessari packag paid version use dont root phone didn want risk foot phone make warranti void ,3
208513,Was told to take my review down and they will refund took it down but never refunded dont buy this buy PACKAGE DISABLER PRO BY POLICEDEVELOPER works great on nougat ,told take review refund took never refus dont buy buy packag disabl pro work great nought ,3
208514,Awesome app!! ,pp ,3
208515,"Stuck on ""Activate SDK"" screen. Tried uninstalling and reinstalling, same thing. Emailed dev but never heard back. ",stuck activ sd screen tri reinstat thing remain de never heard back ,1
208516,Awesome app. Recommended. Saves a lot of battery and resources as it can disable bloatware without rooting the device. ,pp recommend save lot batteri resourc disabl without foot devic ,3
208517,Solved my Note 4 battery issues thank you! ,solv note batteri issu thank ,3
208518,Not working on Stock 7.0 S7 edge ,work stock edg ,1
208519,If this apps not working in nougat update then what should us (who already paid) do? Will you ever fix this? ,ape work nought updat us alreadi paid ever fix ,1
208520,Perfect ,perfect ,3
208521,Great app. Improve my battery life tremendously ,great pp improv batteri life tremend ,3
208522,App is not working on android n ,pp work andro ,1
208523,This app is great. Its the most useful app in managing All the apps on my phone with clarity and simplicity. ,pp great use pp manag ape phone clariti simplic ,3
208524,It does it. The thing. ,thing ,3
208525,To early to tell it did turn off bloatware. I let you know if it saved data usage during this cycle. ,earli tell turn let know save data usag cycl ,3
208526,Live saving! ,live save ,3
208527,Thank you for this application effortless and worth buying. Hope it really.disables some of the application specially the problem i am encountering because of the black screen of death due to the continues running of gear vr services. Hopefully it really fixes it. Cheers! :) ,thank applic worth buy feature realli disabl applic special bug encount black screen death due continu run gear or servic feature realli fix cheer ,3
208528,thanks 4 the kindness refund ... they garantee it ... ty guys ,thank kind refund guarante ty gun ,3
208529,I am still learning as to what can be safely disabled but so far so good. It does what it says. ,still learn safe disabl far good say ,3
208530,Nice to disable bloatware without rooting. ,nice disabl without foot ,3
208531,I paid twice. This used to be ez.package disabler but it seems to have been discontinued and all the disabled app came back. I had to buy this app to disable them again. Would this happen again if you change your name again? ,paid twice use packag disabl seem discontinu disabl pp came back buy pp disabl would happen chang name ,1
208532,DO NOT BUY!!! DOES NOT WORK WITH NOTE 7. Can not register SDK license even download new latest software. :(( already paid for the license. BUY AT UR OWN RISK!!! ,buy work note regist sd licens even download new latest softwar alreadi paid licens buy or risk ,3
208533,Very useful for my S5 ,use ,3
208534,"I disabled all bloatware apps, this resulted to losing multi window feature. Which app should I re enable to bring it back? ",disabl ape result lose multi window featur pp enabl bring back ,3
208535,Stays stuck at active license. Fails to activate after numerous attempts ,stay stuck activ licens bug activ numer attempt ,1
