208536,"I wish you could group apps into different disabled categories so for example if I wanted to enable all my photography apps at the same time I could. Currently it is only possible to do this using the widget which takes up space in your home screen and also if you end up deleting the widget you can kiss that hard work goodbye. So yeah it would definitely make it a lot easier to go back to your previous configuration after you do an OTA. And keeping everything much more organized without having to constantly scroll through a huge list of apps whenever I want to find something. The app also has a very big startup time, but thats a minor issue. Despite its shortcomings it is not a bad app. But it could be better. I would definitely give it 5 stars if the Developers implemented a better sorting system to keep everything organized, as using this app has saved me a lot of battery. ",feature could group ape differ disabl categori exampl want enabl photographi ape time could current possibl use wide take space home screen also end meet wide kiss hard work goodbi yeah would definit make lot easier go back previou configur ta keep everyth much organ without constantli stroll huge list ape whenev want find someth pp also big start time that minor issu despit shortcom bad pp could better would definit give star develop implement better sort system keep everyth organ use pp save lot batteri ,2
208537,Great battery saver ,great batteri save ,3
208538,I absolutely love this program. Thank you from the bottom of my heart. ,absolut love program thank bottom heart ,3
208539,Solved my adroid os battery drain issue by allowing me to disable package that I am not able to disable through the native application menu. Its amazing and useful. I am grateful for your effort ,solv adroit os batteri drain issu allow disabl packag abl disabl nativ applic menu amaz use grate effort ,3
208540,Phone much faster now :) ,phone much faster ,3
208541,App does what it says it will. Worth the price I paid. ,pp say worth price paid ,3
208542,Great app for stopping bloat wear... ,great pp stop boat wear ,3
208543,Works Great! ,work great ,3
208544,"Licence failing to activate S6, unnecessary poor drm ruining this app ",licenc bug activ unnecessari poor arm ruin pp ,1
208545,Awesome! ,,4
208546,Awesome ,,4
208547,Does not activate. I want my money back. ,activ want money back ,3
208548,Perfect ,perfect ,3
208549,Is not working on Samsung s7 edge with the Android 7 F197:G201,work samson edg andro ,1
208550,Works great. No downside. ,work great ,3
208551,"Works as advertised, disable just about any package! Would buy again! ",work advertis disabl packag would buy ,2
208552,Great app and the developer responded to my question the same day ,great pp develop respond question day ,3
208553,Flawless Worth the money for sure ,lawless worth money sure ,3
208554,How re found this app.because i tried remove my note 7 security patch.but i cant remove with this app. ,found pp tri remov note secur patch can remov pp ,1
208555,Great Customer Service ,great custom servic ,3
208556,Good app Usefull. Good for all my Samsung devices - phones and tablets. ,good pp use good samson devic phone tablet ,3
208557,Samsung note 5 Not working. Give my money back ,samson note work give money back ,1
208558,Disabled the files I needed to stop. ,disabl file need stop ,2
208559,Works great! Love it thanks so much!! ,work great love thank much ,3
208560,LOVE it! ,love ,3
208561,Does what it says. It is a permanent background task killer. ,say perman background task killer ,3
208562,"BEST DISABLER! Lots of opinions and works better than any other disabler application for my Galaxy S7 Edge (Not Rooted) and I combined it with Greenify, now I have amazing battery life. Worth the investment. Keep up the good work development! ",best disabl lot opinion work better disabl applic galaxi edg root combin greenish amaz batteri life worth invest keep good work develop ,3
208563,Handy Play CB games on your gear. ,handi play game gear ,3
208564,VERY Useful App Does exactly what it says it will do! Puts control of my Note 5 back in MY hands. Thanks Dev! ,use pp exactli say put control note back hand thank de ,3
208565,Not good.. BUT GREAT! is the best ever...it really helped my note 7 .thank you ,good great best ever realli help note thank ,3
208566,Great App Battery life great live it ,great pp batteri life great live ,3
208567,It can disable the Pre-installed app on my Samsung note 4. But I only give 4 star because i would rather like if you guys can have a option to uninstall those Pre-installed with out rooting the device. ,disabl pp samson note give star would rather like gun option instal foot devic ,2
208568,works very well! know what they are and make sure they are safe to disable before doing so! ,work well know make sure safe disabl ,3
208569,Awesome App Works better than I expected. ,pp work better feature ,3
208570,love it! stopped auto updates ,love stop auto updat ,2
208571,Works!! Well worth it!! Does exactly what it says fixed my issues immediately! ,work well worth exactli say fix issu immedi ,3
208572,Thank u Love this app.. thank u ,thank love pp thank ,3
208573,Let us disable any package! Bring back the options you disabled in the recent updates! We should be able to disable any package! ,let us disabl packag bring back option disabl recent updat abl disabl packag ,2
208574,"You rock, keep up the great work!!! ",rock keep great work ,3
208575,Great application for Galaxy Note 10.1 This is a great app to remove bloatware on Samsung Hardware. Very well-thought-out and easy-to-use interface ,great applic galaxi note 10 great pp remov samson hardwar interfac ,3
208576,Highly recommended Great app and with a material design not like the other ones works great to disable or uninstall apps (S7E running 7.0 beta) ,highli recommend great pp materi design like one work great disabl instal ape she run beta ,3
208577,"Fantastic Does what it says, Simple. ",fantast say simpl ,3
208578,Disabling bloatware saves lives. ,disabl save live ,3
208579,Worked Worked aftr 4-5 attetmpts ,work work after attempt ,3
208580,The best I love this app. ,best love pp ,3
208581,Awesome Great app. Does the job well. ,great pp job well ,3
208582,Works Perfectly I love it!!! ,work perfectli love ,3
208583,nice excelent ,nice excel ,3
208584,"Great program, especially for unrooted phones. ",great program especi root phone ,3
208585,Yes it work well.. With Disabling my gear vr and some bloatware.... ,ye work well disabl gear or ,3
208586,Awesome Good ,good ,3
208587,2016/10/19,"Downloaded 1 min ago, Huge Difference I just used it a min ago and it has made a night and day difference in performance on my S7, highly recommend if yours is sloth slow on you already ",download min ago huge differ use min ago made night day differ perform highli recommend sloth slow alreadi ,3
208588,Did exactly what it claims ,exactli claim ,3
208589,Love this app This app is essential for any android user to disable bloatware and help free system resources! ,love pp pp essenti andro user disabl help free system resourc ,3
208590,Thanks for giving me my battery back! Finally! Something that allows me to disable all of the bloatware (Samsung and AT&T) that was eating my battery all day and that I never ever used. Well worth $0.99! ,thank give batteri back final someth allow disabl samson eat batteri day never ever use well worth 99 ,3
208591,Great app and superb dev Had an immediate response from the dev and it sorted out my issue with the app. ,great pp superb de immedi respons de sort issu pp ,3
208592,As advertised. Shut down those useless apps. (galaxy s7 edge) ,advertis shut useless ape galaxi edg ,3
208593,"Good Not great, good. ",good great good ,3
208594,Great Brilliant application works perfectly. ,great brilliant applic work perfectli ,3
208595,No need for root Disable bloatware without root? Yessir! 5 stars. Phone runs much smoother. ,need root disabl without root lesser star phone run much smoother ,3
208596,"Did what I need Saved me a lot of battery disabling apps. Many say it does not make a difference, but it did for me. ",need save lot batteri disabl ape mani say make differ ,3
208597,Great App! ,great pp ,3
208598,Works The best ,work best ,3
208599,Good ,good ,3
208600,Great app Removed a ton of bloatware from my S7. Battery is working much better now. ,great pp remov ton batteri work much better ,3
208601,Good app!!! ,good pp ,3
208602,What a dumb update... You should not restrict what packages are allowed to be disabled. Good thing I have an older version of your app saved off. ,dumb updat restrict packag allow disabl good thing older version pp save ,2
208603,Will not disable Gear VR Services ,disabl gear or servic ,2
208604,"Insane app. Well worth the money, made my S6 noticeably faster, impressive! Phone is buttery smooth. ",insan pp well worth money made notic faster impress phone batteri smooth ,3
208605,Yes Just yes ,ye ye ,3
208606,Great app!!! ,great pp ,3
208607,Keep getting error msg would like a refund ,keep get bug mug would like refund ,1
208608,The perfect answer to bloatwear. Works perfectly with Marshmellow on my note4 ,perfect answer work perfectli note ,3
208609,It was working great before in my note 5 but since the update was come it stop working.pls help guys it is really a great app ,work great note sinc updat come stop work pu help gun realli great pp ,1
208610,Wow Thank you for making my dreams a reality!!!! ,now thank make dream realiti ,3
208611,So far... - so good. Thank you! ,far good thank ,3
208612,Not working ,work ,1
208613,Simple Major battery improvements ,simpl major batteri improv ,3
208614,Nice ,nice ,3
208615,The real deal Actually keeps the apps off ,real deal actual keep ape ,3
208616,Awesomely effective! ,effect ,3
208617,Excellent Working on my Note 4 ,excel work note ,3
208618,"Works as promised. It is no doubt a great app, cheap and fully functional. Plus the developers are really helpful. ",work promis doubt great pp cheap fulli function plu develop realli help ,3
208619,Hmmm Can anyone can tell me what to disable on my note 7? ,mmm anyon tell disabl note ,1
208620,What a waste It did absolutely nothing ,wast absolut noth ,3
208621,"Nice interface Works as well as the others, has a nice interface. Search for running apps can be a bit slow, but overall well done! ",nice interfac work well other nice interfac search run ape bit slow overal well done ,2
208622,Salamat Salamat ,,4
208623,Apps Great to free space on the phone so it can run smoothly ,ape great free space phone run smoothli ,3
208624,Awsome Woks perfectly on my Galaxy S7 Edge its very worth the Dollar that it costs. ,some work perfectli galaxi edg worth dollar cost ,3
208625,Perfect app Very simple to use and clear instructions for a noobie like me ,perfect pp simpl use clear instruct nobl like ,3
208626,"Amazing this app is remarkable, disables ANYTHING!! and developer will help with any problem. i have an UNrooted Galaxy S7 btw. ",amaz pp remark disabl anyth develop help bug root galaxi bow ,3
208627,"Keeps Getting Better The application does what it says. It also gets updated frequently, often adding functionality. ",keep get better applic say also get updat frequent often ad ,3
208628,Very nice app Works as advertised. Nice. ,nice pp work advertis nice ,3
208629,Excellent app! Really helped my phones battery life after the recent update ,excel pp realli help phone batteri life recent updat ,3
208630,Great app Works as promised ,great pp work promis ,3
208631,"Thanks Great app, nice alternative to rooting. Perhaps add an option to print disabled list..? ",thank great pp nice altern foot perhap feature option print disabl list ,2
208632,2016/6/16,"Perfect app, work like a charm Very nice interface and easy to use ",perfect pp work like charm nice interfac easi use ,3
208633,Works ,work ,3
208634,Love it ,love ,3
208635,Great Work well on my S7 ,great work well ,3
208636,"Perfect for AT&T devices Since no root has been found for the latest Att S5 software this is pretty much the golden ticket to remove all the crapware installed on my S5 and other carrier devices. Does exactly as advertised, 5 stars. No less ",perfect devic sinc root found latest att softwar pretti much golden ticket remov instal carrier devic exactli advertis star less ,3
208637,I love this app This app rocks ,love pp pp rock ,3
208638,"A must have app worth every penny i extremely recommended ,love it even more with the new widget, and developers always listening for any issues that u have. Thanks ",must pp worth everi penni extrem recommend love even new wide develop alway listen issu thank ,3
208639,Great App for S7 Really great and helpful app to get rid of all the bloat that came on the S7. Makes phone run snappier and feels nice again. ,great pp realli great help pp get rid boat came make phone run happier feel nice ,3
208640,It works Not sure whether it helps me with the battery drain on my Samsung. But definitely helps to remove the annoying issue of having two keyboards due to Samsung keyboard ,work sure whether help batteri drain samson definit help remov annoy issu two keyboard due samson keyboard ,3
208641,Great app all around ,great pp around ,3
208642,Pekto Good app ,porto good pp ,3
208643,2016/5/30,"Great, but... Can you make this app invisible from the app drawer? ",great make pp invis pp drawer ,2
208644,Dont work app is still running ,dont work pp still run ,1
208645,"A great app. Easy to use, a nice interface with instant results. Does an excellent job. Many thanks. Dom Peters, Auckland NZ ",great pp easi use nice interfac instant result excel job mani thank do peter auckland no ,3
208646,Very Good Seems to help save battery life ! ,good seem help save batteri life ,3
208647,It works...reccomended ! ,work recommend ,3
208648,"Great! Samsung should use this programs data to know which apps people find useful and useless. Definitely worth the money, recommend this to all Galaxy owners. ",great samson use program data know ape peopl find use useless definit worth money recommend galaxi owner ,3
208649,Doesnot work on themes on my galaxy s7 edge It simply is not working on themes. It is not stopping the theme counter on paid themes. ,doesn work theme galaxi edg simpli work theme stop theme counter paid theme ,1
208650,Works A+ app highly recommend ,work pp highli recommend ,3
208651,Does a great job Enabled many features in the phone with ease. ,great job enabl mani featur phone eas ,3
208652,"So far so good, helps with creepy high tech peeping toms ",far good help creep high teach peep toe ,3
208653,"Yes for the samsung bloatwares I am so sick of them and this is the solution, thank you, I paid for this. :) ",ye samson sick solut thank paid ,3
208654,Works perfectly ,work perfectli ,3
208655,Great Worth it. ,great worth ,3
208656,"Perfect App Buy this app, worth way more money than what they ask for! ",perfect pp buy pp worth way money ask ,3
208657,"No problems Good, easy to use app. ",bug good easi use pp ,3
208658,Good app to disable system apps without root.. ,good pp disabl system ape without root ,3
208659,Absolute boss ,absolut boss ,3
208660,Worked great to disable Samsung gear service ,work great disabl samson gear servic ,3
208661,Not working Judt rolls on with activating license and updating bloatware for nearly 30 minutes ,work just roll captiv licens date nearli 30 minut ,1
208662,Laggy/poor performance ,perform ,3
208663,Cool ,cool ,3
208664,This app works exactly as described. Awesome. ,pp work exactli describ ,3
208665,Good app Very usfull app for saving battery ,good pp full pp save batteri ,3
208666,Very usefull May I have the apps list that can be deactived without affects to normal phone working ? ,use may ape list deceiv without affect normal phone work ,2
208667,Awesome Very useful ,use ,3
208668,Terrible developer makes crappy software Shamelessly ripping off every feature of others. What a crappy developer with no imagination and work ethics ,terribl develop make happi softwar shamelessli lip everi featur other happi develop imagin work ethic ,2
208669,"Good It works. Small app with great result, just for 99 cents ",good work small pp great result 99 cent ,3
208670,Does what it says on the tin thanks ,say tin thank ,3
208671,"great app, simple to use. ",great pp simpl use ,3
208672,2016/5/13,"Very useful, work perfect on my galaxy s7 Disabled all bloat apps ",use work perfect galaxi disabl boat ape ,3
208673,Awesome!! Any samsung vr gear user this is a must buy as only takes 2 taps to disable the oculus store and then the play store apps are yours for the taking ,samson or gear user must buy take cap disabl ocular store play store ape take ,3
208674,Excellent Works well with my note5. ,excel work well note ,3
208675,"Works great. Nice ui and speed. Although i have had no problems with any of the versions, its nice to see the developer keeping this app updated consistently. ",work great nice speed although bug version nice see develop keep pp updat consist ,3
208676,Love it! It actually appears to work!!! Very happy! ,love actual appear work happi ,3
208677,"Great A must have for Note 5 owners, helps a lot with battery life ",great must note owner help lot batteri life ,3
208678,The Best App Ever DEATH To The Evil BLOATWARE ,best pp ever death evil ,3
208679,Works for what I need ,work need ,3
208680,Battery Saver Absolutely improves battery life. ,batteri save absolut improv batteri life ,3
208681,"Awesome and Easy You can close your eyes and use this app.. it is that easy. Works really well for gear vr, with widget. ",easi close eye use pp easi work realli well gear or wide ,3
208682,Great No root and works perfect S7 here ,great root work perfect ,3
208683,Cool Nice app helps alot ,cool nice pp help clot ,3
208684,"So far so good Disabled some programs that suck up battery. Can also disable Oculus so that Google cardboard apps will work on the Gear vr. If it messes my phone up down the line, I will update my rating. ",far good disabl program suck batteri also disabl ocular goos cardboard ape work gear or mass phone line updat rate ,3
208685,Outstanding! Works just like it says! ,outstand work like say ,3
208686,Galaxy s7 edge Easy to monitor ram used. ,galaxi edg easi monitor ram use ,3
208687,"Awesome! Work perfect on my S7 edge Very good, help us a lot to disable crap app ",work perfect edg good help us lot disabl cap pp ,3
208688,do what says ,say ,3
208689,love it ,love ,3
208690,Awesome thanks Awesome app even for no root very nice a+a million ,thank pp even root nice ana million ,3
208691,"the best disabler app forever Material design, and very useful with my gakaxy s7 edge ",best disabl pp forev materi design use galaxi edg ,3
208692, work well",2016/4/19,"Awesome, run so fast, work well Support me a lot, now I can save my battery life and RAM by disable all bloat, thanks ",work well run fast work well support lot save batteri life ram disabl boat thank ,3
208693,Great app No need for root with this !! ,great pp need root ,3
208694,Very effective and works really well. My only hope and wish is better/more details of what apps/packages do or are. ,effect work realli well feature feature detail ,2
208695,Great App! Great for disabling bloatware without root ,great pp great disabl without root ,3
208696,Good app Will test it on my s8+ soon ,good pp test soon ,3
208697,"Disables a bunch of useless apps. After the last update, I get reboots after disabling apps. Not disabling required apps either. Also, the license check on this app is a pain. I have quite a few paid apps and this is the only one that takes forever to go through. ",disabl bunch useless ape last updat get boot disabl ape disabl requir ape either also licens check pp pain quit paid ape one take forev go ,2
208698,"Never left a review before, so here goes. I really like Samsung phones, but hate the bloatware. No option to root, and if there was you would have security vulnerabilities. With that said, this app is awesome, totally worth it. Does exactly what it says. Also has the backup option. ",never left review goe realli like samson phone hate option root would secur said pp total worth exactli say also back option ,3
208699,"Works for my S8, but interface could use some improvement. ",work interfac could use improv ,2
208700,"Used to work fine, had to do a factory reset, now it says I am rooted when I am not. HELPPPPPPPP Edit: I guess they fixed it. Working fine now. Thanks ",use work fine factori rest say root edit guess fix work fine thank ,3
208701,"Easy, works and love it ",easi work love ,3
208702,NO Changelog = NO Respect = NO Trust ,respect trust ,2
208703,Excellent application. I lost root privileges when I bought my S7 edge. This at least allows me to suspend system & user apps. IMPORTANT: Are there any possible exploits that would allow the suspended apps to be deleted with Package Disabler Pro or another 3rd party app? ~ ,excel applic lost root privileg bought edg least allow suspend system user ape import possibl exploit would allow suspend ape delet packag disabl pro anoth rd parti pp ,2
208704,Great app. Developer responds in minutes. A+ ,great pp develop respond minut ,3
208705,I love this app. Does what it says. ,love pp say ,3
208706,"Hello battery life, my old friend, I missed you. And goodbye Bixby. I only knew you for a short time but I hated every second you showed your face when I was just trying to pick up my phone. ",hello batteri life old friend feature goodbi babi knew short time hate everi second show face tri pick phone ,3
208707,It works nice again ,work nice ,3
208708,Must have! No more bixby ,must babi ,3
208709,Very useful! ,use ,3
208710,"The app is a pretty good app if you want a slight difference in battery life, maybe if it worked better it might get a better review, but for now im down 1 dollar and some change. Not a big deal just wished to gave what it promised. ",pp pretti good pp want slight differ batteri life mayb work better might get better review in dollar chang big deal feature gave promis ,2
208711,Feels great! Just downloaded and tested: it disables apps and blocks them from the app list till you enable again. I am using it to disable apps that I seldom use but are still needed. I can activate them back when I wish. ,feel great download test disabl ape block pp list till enabl use disabl ape seldom use still need activ back feature ,3
208712,Best £1.39 ive ever spent. After nougat update device security kept telling me an app i have used fpr years is malware. Installed this and now all quiet. Lovely! ,,4
208713,"I get stuck on a screen that says ""please wait while activating your device"". Waited a good hour and still nothing. Your app is broken. Please fix it. ",get stuck screen say pleas wait captiv devic wait good hour still noth pp broken pleas fix ,1
208714,Great app. Works perfect with no root on multiple Samsung galaxy phones. ,great pp work perfect root multipl samson galaxi phone ,3
208715,Did not disable any apps. I emailed them but got no response. ,disabl ape remain got respons ,3
208716,Great for disabling all the prepackaged apps AT&T put on my phone that I do not need and frees up my phone. ,great disabl ape put phone need free phone ,3
208717,I found the ultimate solution that is better than this app! Throw your bloated Samsung device away and get a Pixel! ,found ultim solut better pp throw bloat samson devic away get fix ,3
208718,Great app however it would be easier if there was a show all current running apps and show all bloatware instead of everything on one page ,great pp howev would easier show current run ape show instead everyth one page ,2
208719,I have a Samsung S7 Edge. This app was perfect in finally stopping that horrid system update that kept pestering me to update to the Nougat. I highly recommend this to anyone wishing to stop unwanted system updates or to simply manage apps. ,samson edg pp perfect final stop horrid system updat kept bug updat nought highli recommend anyon feature stop unwant system updat simpli manag ape ,3
208720,"It drained my battery, 5 hrs tops while not doing anything with the phone. ",drain batteri hi top anyth phone ,3
208721,Not working on s6 edge plus updated to nougat. ,work edg plu updat nought ,1
208722,"This app no longer disables software updates, which makes it useless for my needs. UPDATE: Software update is now listed and able to disable! ",pp longer disabl softwar updat make useless need updat softwar updat list abl disabl ,3
208723,"Works, but the interface is fugly. ",work interfac fulli ,2
208724,"Very useful and easy to use. Go slow, read and think. It works great. ",use easi use go slow read think work great ,3
208725,Great app Good customer service It helped me to disable above 150 bloatwares Thank you developers ,great pp good custom servic help disabl 150 thank develop ,3
208726,Perfect ,perfect ,3
208727,First app downloaded when I get a new device or reset one. I cannot believe the level of control without root. Super easy to use. ,first pp download get new devic rest one believ level control without root super easi use ,3
208728,2 stars until you start providing changelogs with updates. ,star start provid updat ,2
208729,"Great work, buddy! Your latest ""update"" which was supposedly aimed at eliminating ""activation problems"" has caused the app to become inactive on mine (S8)! Sheesh. ",great work muddi latest updat supposedli aim elimin motiv bug caus pp becom inact mine speech ,1
208730,Finally managed to disable Gear and VR! Yasss!! ,final manag disabl gear or case ,3
